{
  "frente": "ourinhos",
  "situacao": "preparacao",
  "atualizado_em": "2026-08-04",
  "estados": {
    "atestado": {
      "estado": "concluido",
      "nota": "A Samais já operou no município — atestado disponível para verificação formal."
    },
    "assinatura": {
      "estado": "pendente",
      "nota": "Em negociação; possível via emergencial."
    },
    "headcount-fc": {
      "estado": "em-andamento",
      "nota": "Não se parte do zero: população (~106 mil) é praticamente idêntica à de Avaré+Manduri, cujo estudo fecha em ~R$ 1,0 mi/mês (R$ 9,50/hab). Serve de referência para resposta rápida, a calibrar com o histórico real de atendimentos."
    },
    "cct": {
      "estado": "pendente",
      "nota": "CCT-SP."
    },
    "inventario-frota": {
      "estado": "pendente",
      "nota": "Levantar estado real da frota — relato de degradação do serviço."
    },
    "ordem-servico": {
      "estado": "pendente",
      "nota": "Depende da via de contratação."
    },
    "benchmark": {
      "estado": "concluido",
      "nota": "Régua histórica do próprio contrato Samais em Ourinhos: R$ 159 mil/viatura/mês — o valor mais alto da tabela de referência do mercado."
    }
  }
}
