{
  "frente": "belem",
  "situacao": "preparacao",
  "atualizado_em": "2026-08-04",
  "estados": {
    "assinatura": {
      "estado": "concluido",
      "nota": "Frente reportada como FECHADA em 30/07/2026."
    },
    "postos-viaturas": {
      "estado": "em-andamento",
      "nota": "Estudo dimensiona 20 USB + 4 USA + 4 moto + 1 ambulancha (29 unidades). Confirmar o que entrou no contrato."
    },
    "headcount-fc": {
      "estado": "pendente",
      "nota": "⚠️ Diligência de headcount real com FC 4,5. É a maior frente do pipeline: erro aqui é caro."
    },
    "cct": {
      "estado": "pendente",
      "nota": "CCT-PA a fechar."
    },
    "valor-mensal": {
      "estado": "em-andamento",
      "nota": "Estudo fecha em ~R$ 8,1 mi/mês (20 USB) e bate com o alvo verbal do CEO (R$ 7,9 mi). Falta conferir contra o valor efetivamente contratado."
    },
    "ordem-servico": {
      "estado": "pendente",
      "nota": "Sem data contratual confirmada."
    },
    "benchmark": {
      "estado": "concluido",
      "nota": "R$ 280k/viatura/mês — acima da régua de mercado (Ourinhos R$ 159k, CIMSAMU R$ 94k, FAHECE R$ 93k). Justificado pelo porte e escopo; documentar a diferença."
    }
  }
}
